[
  {
    "id": "af",
    "name": "Afghanistan",
    "alpha_2_code": "AF",
    "alpha_3_code": "AFG",
    "numeric_code": "004",
    "region_code": "142",
    "region_name": "Asia",
    "subregion_code": "034",
    "subregion_name": "Southern Asia",
    "calling_codes": [
      "+93"
    ],
    "flag_emoji": "🇦🇫",
    "flag_svg_url": "/v1/assets/flags/af.svg",
    "flag_url": "/v1/assets/flags/af.svg"
  },
  {
    "id": "al",
    "name": "Albania",
    "alpha_2_code": "AL",
    "alpha_3_code": "ALB",
    "numeric_code": "008",
    "region_code": "150",
    "region_name": "Europe",
    "subregion_code": "039",
    "subregion_name": "Southern Europe",
    "calling_codes": [
      "+355"
    ],
    "flag_emoji": "🇦🇱",
    "flag_svg_url": "/v1/assets/flags/al.svg",
    "flag_url": "/v1/assets/flags/al.svg"
  },
  {
    "id": "dz",
    "name": "Algeria",
    "alpha_2_code": "DZ",
    "alpha_3_code": "DZA",
    "numeric_code": "012",
    "region_code": "002",
    "region_name": "Africa",
    "subregion_code": "015",
    "subregion_name": "Northern Africa",
    "calling_codes": [
      "+213"
    ],
    "flag_emoji": "🇩🇿",
    "flag_svg_url": "/v1/assets/flags/dz.svg",
    "flag_url": "/v1/assets/flags/dz.svg"
  },
  {
    "id": "as",
    "name": "American Samoa",
    "alpha_2_code": "AS",
    "alpha_3_code": "ASM",
    "numeric_code": "016",
    "region_code": "009",
    "region_name": "Oceania",
    "subregion_code": "061",
    "subregion_name": "Polynesia",
    "calling_codes": [
      "+1-684"
    ],
    "flag_emoji": "🇦🇸",
    "flag_svg_url": "/v1/assets/flags/as.svg",
    "flag_url": "/v1/assets/flags/as.svg"
  },
  {
    "id": "ad",
    "name": "Andorra",
    "alpha_2_code": "AD",
    "alpha_3_code": "AND",
    "numeric_code": "020",
    "region_code": "150",
    "region_name": "Europe",
    "subregion_code": "039",
    "subregion_name": "Southern Europe",
    "calling_codes": [
      "+376"
    ],
    "flag_emoji": "🇦🇩",
    "flag_svg_url": "/v1/assets/flags/ad.svg",
    "flag_url": "/v1/assets/flags/ad.svg"
  },
  {
    "id": "ao",
    "name": "Angola",
    "alpha_2_code": "AO",
    "alpha_3_code": "AGO",
    "numeric_code": "024",
    "region_code": "002",
    "region_name": "Africa",
    "subregion_code": "202",
    "subregion_name": "Sub-Saharan Africa",
    "intermediate_region_code": "017",
    "intermediate_region_name": "Middle Africa",
    "calling_codes": [
      "+244"
    ],
    "flag_emoji": "🇦🇴",
    "flag_svg_url": "/v1/assets/flags/ao.svg",
    "flag_url": "/v1/assets/flags/ao.svg"
  },
  {
    "id": "ai",
    "name": "Anguilla",
    "alpha_2_code": "AI",
    "alpha_3_code": "AIA",
    "numeric_code": "660",
    "region_code": "019",
    "region_name": "Americas",
    "subregion_code": "419",
    "subregion_name": "Latin America and the Caribbean",
    "intermediate_region_code": "029",
    "intermediate_region_name": "Caribbean",
    "calling_codes": [
      "+1-264"
    ],
    "flag_emoji": "🇦🇮",
    "flag_svg_url": "/v1/assets/flags/ai.svg",
    "flag_url": "/v1/assets/flags/ai.svg"
  },
  {
    "id": "aq",
    "name": "Antarctica",
    "alpha_2_code": "AQ",
    "alpha_3_code": "ATA",
    "numeric_code": "010",
    "flag_emoji": "🇦🇶",
    "flag_svg_url": "/v1/assets/flags/aq.svg",
    "flag_url": "/v1/assets/flags/aq.svg"
  },
  {
    "id": "ag",
    "name": "Antigua and Barbuda",
    "alpha_2_code": "AG",
    "alpha_3_code": "ATG",
    "numeric_code": "028",
    "region_code": "019",
    "region_name": "Americas",
    "subregion_code": "419",
    "subregion_name": "Latin America and the Caribbean",
    "intermediate_region_code": "029",
    "intermediate_region_name": "Caribbean",
    "calling_codes": [
      "+1-268"
    ],
    "flag_emoji": "🇦🇬",
    "flag_svg_url": "/v1/assets/flags/ag.svg",
    "flag_url": "/v1/assets/flags/ag.svg"
  },
  {
    "id": "ar",
    "name": "Argentina",
    "alpha_2_code": "AR",
    "alpha_3_code": "ARG",
    "numeric_code": "032",
    "region_code": "019",
    "region_name": "Americas",
    "subregion_code": "419",
    "subregion_name": "Latin America and the Caribbean",
    "intermediate_region_code": "005",
    "intermediate_region_name": "South America",
    "calling_codes": [
      "+54"
    ],
    "flag_emoji": "🇦🇷",
    "flag_svg_url": "/v1/assets/flags/ar.svg",
    "flag_url": "/v1/assets/flags/ar.svg"
  },
  {
    "id": "am",
    "name": "Armenia",
    "alpha_2_code": "AM",
    "alpha_3_code": "ARM",
    "numeric_code": "051",
    "region_code": "142",
    "region_name": "Asia",
    "subregion_code": "145",
    "subregion_name": "Western Asia",
    "calling_codes": [
      "+374"
    ],
    "flag_emoji": "🇦🇲",
    "flag_svg_url": "/v1/assets/flags/am.svg",
    "flag_url": "/v1/assets/flags/am.svg"
  },
  {
    "id": "aw",
    "name": "Aruba",
    "alpha_2_code": "AW",
    "alpha_3_code": "ABW",
    "numeric_code": "533",
    "region_code": "019",
    "region_name": "Americas",
    "subregion_code": "419",
    "subregion_name": "Latin America and the Caribbean",
    "intermediate_region_code": "029",
    "intermediate_region_name": "Caribbean",
    "calling_codes": [
      "+297"
    ],
    "flag_emoji": "🇦🇼",
    "flag_svg_url": "/v1/assets/flags/aw.svg",
    "flag_url": "/v1/assets/flags/aw.svg"
  },
  {
    "id": "au",
    "name": "Australia",
    "alpha_2_code": "AU",
    "alpha_3_code": "AUS",
    "numeric_code": "036",
    "region_code": "009",
    "region_name": "Oceania",
    "subregion_code": "053",
    "subregion_name": "Australia and New Zealand",
    "calling_codes": [
      "+61"
    ],
    "flag_emoji": "🇦🇺",
    "flag_svg_url": "/v1/assets/flags/au.svg",
    "flag_url": "/v1/assets/flags/au.svg"
  },
  {
    "id": "at",
    "name": "Austria",
    "alpha_2_code": "AT",
    "alpha_3_code": "AUT",
    "numeric_code": "040",
    "region_code": "150",
    "region_name": "Europe",
    "subregion_code": "155",
    "subregion_name": "Western Europe",
    "calling_codes": [
      "+43"
    ],
    "flag_emoji": "🇦🇹",
    "flag_svg_url": "/v1/assets/flags/at.svg",
    "flag_url": "/v1/assets/flags/at.svg"
  },
  {
    "id": "az",
    "name": "Azerbaijan",
    "alpha_2_code": "AZ",
    "alpha_3_code": "AZE",
    "numeric_code": "031",
    "region_code": "142",
    "region_name": "Asia",
    "subregion_code": "145",
    "subregion_name": "Western Asia",
    "calling_codes": [
      "+994"
    ],
    "flag_emoji": "🇦🇿",
    "flag_svg_url": "/v1/assets/flags/az.svg",
    "flag_url": "/v1/assets/flags/az.svg"
  },
  {
    "id": "bs",
    "name": "Bahamas",
    "alpha_2_code": "BS",
    "alpha_3_code": "BHS",
    "numeric_code": "044",
    "region_code": "019",
    "region_name": "Americas",
    "subregion_code": "419",
    "subregion_name": "Latin America and the Caribbean",
    "intermediate_region_code": "029",
    "intermediate_region_name": "Caribbean",
    "calling_codes": [
      "+1-242"
    ],
    "flag_emoji": "🇧🇸",
    "flag_svg_url": "/v1/assets/flags/bs.svg",
    "flag_url": "/v1/assets/flags/bs.svg"
  },
  {
    "id": "bh",
    "name": "Bahrain",
    "alpha_2_code": "BH",
    "alpha_3_code": "BHR",
    "numeric_code": "048",
    "region_code": "142",
    "region_name": "Asia",
    "subregion_code": "145",
    "subregion_name": "Western Asia",
    "calling_codes": [
      "+973"
    ],
    "flag_emoji": "🇧🇭",
    "flag_svg_url": "/v1/assets/flags/bh.svg",
    "flag_url": "/v1/assets/flags/bh.svg"
  },
  {
    "id": "bd",
    "name": "Bangladesh",
    "alpha_2_code": "BD",
    "alpha_3_code": "BGD",
    "numeric_code": "050",
    "region_code": "142",
    "region_name": "Asia",
    "subregion_code": "034",
    "subregion_name": "Southern Asia",
    "calling_codes": [
      "+880"
    ],
    "flag_emoji": "🇧🇩",
    "flag_svg_url": "/v1/assets/flags/bd.svg",
    "flag_url": "/v1/assets/flags/bd.svg"
  },
  {
    "id": "bb",
    "name": "Barbados",
    "alpha_2_code": "BB",
    "alpha_3_code": "BRB",
    "numeric_code": "052",
    "region_code": "019",
    "region_name": "Americas",
    "subregion_code": "419",
    "subregion_name": "Latin America and the Caribbean",
    "intermediate_region_code": "029",
    "intermediate_region_name": "Caribbean",
    "calling_codes": [
      "+1-246"
    ],
    "flag_emoji": "🇧🇧",
    "flag_svg_url": "/v1/assets/flags/bb.svg",
    "flag_url": "/v1/assets/flags/bb.svg"
  },
  {
    "id": "by",
    "name": "Belarus",
    "alpha_2_code": "BY",
    "alpha_3_code": "BLR",
    "numeric_code": "112",
    "region_code": "150",
    "region_name": "Europe",
    "subregion_code": "151",
    "subregion_name": "Eastern Europe",
    "calling_codes": [
      "+375"
    ],
    "flag_emoji": "🇧🇾",
    "flag_svg_url": "/v1/assets/flags/by.svg",
    "flag_url": "/v1/assets/flags/by.svg"
  },
  {
    "id": "be",
    "name": "Belgium",
    "alpha_2_code": "BE",
    "alpha_3_code": "BEL",
    "numeric_code": "056",
    "region_code": "150",
    "region_name": "Europe",
    "subregion_code": "155",
    "subregion_name": "Western Europe",
    "calling_codes": [
      "+32"
    ],
    "flag_emoji": "🇧🇪",
    "flag_svg_url": "/v1/assets/flags/be.svg",
    "flag_url": "/v1/assets/flags/be.svg"
  },
  {
    "id": "bz",
    "name": "Belize",
    "alpha_2_code": "BZ",
    "alpha_3_code": "BLZ",
    "numeric_code": "084",
    "region_code": "019",
    "region_name": "Americas",
    "subregion_code": "419",
    "subregion_name": "Latin America and the Caribbean",
    "intermediate_region_code": "013",
    "intermediate_region_name": "Central America",
    "calling_codes": [
      "+501"
    ],
    "flag_emoji": "🇧🇿",
    "flag_svg_url": "/v1/assets/flags/bz.svg",
    "flag_url": "/v1/assets/flags/bz.svg"
  },
  {
    "id": "bj",
    "name": "Benin",
    "alpha_2_code": "BJ",
    "alpha_3_code": "BEN",
    "numeric_code": "204",
    "region_code": "002",
    "region_name": "Africa",
    "subregion_code": "202",
    "subregion_name": "Sub-Saharan Africa",
    "intermediate_region_code": "011",